influencer_id,platform,date,URL,caption,reach,likes,comments
91,YouTube,2025-04-18,https://youtube.com/post/9a70df34-243a-49b4-bb03-dc25cfa2c152,Media sometimes exist front they car.,219812,42469,8086
91,YouTube,2025-03-26,https://youtube.com/post/9cd21a26-f702-4dc9-8bc7-2d1326570cfb,Matter policy car eye country.,124522,11246,1849
91,YouTube,2025-06-04,https://youtube.com/post/aff6d115-8311-4096-b807-4ca24914ecfa,Should meeting five our attention maybe.,950963,107572,8897
91,YouTube,2025-07-14,https://youtube.com/post/4413d562-f9e7-4b71-91ff-b0e1a900d2e3,Development purpose our tend just fish world.,476244,101478,11211
92,Instagram,2025-06-17,https://instagram.com/post/8e4aa725-d54c-477f-b93b-b8ef2b95dc89,Last bank pretty teacher ten alone.,427781,37739,3422
92,Instagram,2025-05-27,https://instagram.com/post/f7b3e889-2a4b-4ab5-84c9-dddb13122561,Those best send good glass thousand.,441742,98578,8519
93,Instagram,2025-03-31,https://instagram.com/post/bb866e75-388c-4479-9e94-ec8a19931204,Hit chair stand evidence detail executive compare pick even.,932907,128172,12561
93,Instagram,2025-03-08,https://instagram.com/post/5af707c0-1c2a-424b-9fff-c58f83cd9acf,International south factor among.,556071,134177,11758
94,Twitter,2025-05-19,https://twitter.com/post/b75ce121-1ab3-4b80-8be6-b79b3f52b82a,Others go tough herself value Mr raise arm.,175437,26228,4908
94,Twitter,2025-04-29,https://twitter.com/post/e2a76b83-88db-4d5d-a70c-8f87eea35a9c,Wall success direction can real their choose.,182332,38331,5887
94,Twitter,2025-03-05,https://twitter.com/post/638db378-8b35-45a2-8729-159102743495,Hit hit mind individual interesting fire film.,50749,8652,1469
95,YouTube,2025-05-24,https://youtube.com/post/af764557-e19d-4697-a990-421e46598416,Measure image staff poor gun environment.,424809,28043,3992
95,YouTube,2025-06-11,https://youtube.com/post/32287096-6593-4d6d-98c9-d111e41dda55,Fact quite eight popular reduce.,409641,69853,7155
95,YouTube,2025-02-25,https://youtube.com/post/d9b2e823-17ef-4fd4-8c5d-46be944c48d0,Rise training pattern hair three upon interest necessary to class.,804711,96814,3601
95,YouTube,2025-07-13,https://youtube.com/post/ab6f6bdb-af4a-4ebb-bf16-a851ff41d9fa,Interesting evidence parent side heart sell baby husband.,990533,119370,23836
96,Instagram,2025-03-19,https://instagram.com/post/ec4e855d-59f5-47a9-9559-7721782fb659,Camera why night air factor case necessary continue.,736414,153391,6097
96,Instagram,2025-01-30,https://instagram.com/post/e757c1b9-a415-48f9-9a1a-d7810395dccb,Later but gun these chance care.,768391,100845,11821
96,Instagram,2025-03-08,https://instagram.com/post/ba39d795-551d-4ca3-92e8-fc57e6c68e30,Politics suffer computer poor agree.,847755,69513,2453
96,Instagram,2025-07-07,https://instagram.com/post/fa400d20-31e1-4b80-8675-e2357da1bb89,Look ground myself often want office focus school these decade.,947343,175843,18373
97,Twitter,2025-03-03,https://twitter.com/post/851be0ed-2777-46f3-870a-011d1de5b189,Success consumer suddenly control left ask small great.,34456,7087,653
97,Twitter,2025-05-24,https://twitter.com/post/cd1a94b2-c586-4a67-89e0-f08516b8c91b,Next entire feel identify game goal beat.,103223,16871,2241
97,Twitter,2025-02-20,https://twitter.com/post/52cc7628-c9b1-4310-a9ca-a25ab95fd3f5,Story power rather daughter issue campaign unit garden wind we.,167761,40223,3750
98,Twitter,2025-01-28,https://twitter.com/post/040c4672-4c09-4233-9dda-cc9ab5750ccd,Clearly tonight face smile dream treatment future partner though them style.,669909,104433,10199
98,Twitter,2025-04-14,https://twitter.com/post/ceb9bbae-bf4f-4814-8a33-0e1ed0d65871,Write opportunity key behind short main former.,746126,74554,3674
99,Twitter,2025-04-20,https://twitter.com/post/b204662b-28c1-43c4-88c8-6ebd709707b4,Little town easy wind amount order painting.,542275,69084,8668
99,Twitter,2025-06-07,https://twitter.com/post/2d0b4999-983e-44a3-a215-6743d7587dc1,Meet rather skin gas lose whatever result.,324183,33085,3502
99,Twitter,2025-06-28,https://twitter.com/post/be1e7330-993d-422e-a233-be6fafd2bcb5,Put collection national great couple region beautiful join.,999405,107051,19890
100,YouTube,2025-03-09,https://youtube.com/post/163461cc-e8ae-4287-9fb2-90a58d830070,Suggest total fish its window appear leave minute home.,291474,22485,957
100,YouTube,2025-03-08,https://youtube.com/post/d9405bc1-c020-4c5e-a843-530534d156f9,Matter others base traditional watch management stage open.,263915,50849,10146
100,YouTube,2025-02-14,https://youtube.com/post/25f865d3-7b41-4ffa-86ad-673038ff6f00,Explain out performance nearly between buy bad relationship teach sell.,902621,219799,43458
100,YouTube,2025-06-30,https://youtube.com/post/1f4f25fc-3bd0-4a40-84e6-abd41b475bba,Natural law view hotel little suffer open station church.,759758,145803,18006
100,YouTube,2025-06-04,https://youtube.com/post/87f6324b-7e90-4585-886c-5aaea2f961bc,Fire night soon rich gas long itself.,381778,41992,2384
