influencer_id,platform,date,URL,caption,reach,likes,comments
45,YouTube,2025-06-27,https://youtube.com/post/3735e150-656c-4d3f-89bf-c891f894d2a4,Loss door move this direction end its eat.,366770,52466,4139
45,YouTube,2025-01-23,https://youtube.com/post/7387b0da-19a1-4d16-9f71-76f4c18b58e7,Responsibility note grow several discuss have your check gas.,236224,15300,2917
46,Twitter,2025-05-25,https://twitter.com/post/28a0a408-64b3-4f31-848a-ac483f9b14c1,Understand part hope traditional from information kitchen surface.,765350,103216,7484
46,Twitter,2025-04-14,https://twitter.com/post/926b7251-da6f-4627-8e3c-072a5d375371,Nor drop capital camera during.,981754,88204,8414
46,Twitter,2025-07-15,https://twitter.com/post/aab4a345-88f5-4ef2-8729-a45dd709c0a0,Pm piece forget peace public sense truth along.,602044,58663,7463
46,Twitter,2025-04-15,https://twitter.com/post/0b6f722a-8c30-46f5-af2c-5e8c1a5d98cd,Yourself crime foreign school receive until own speak.,698104,173505,13913
47,Instagram,2025-06-21,https://instagram.com/post/78c85ead-029e-429a-8f80-18590bacf966,Moment but significant ground forget.,98718,16109,2361
47,Instagram,2025-05-05,https://instagram.com/post/e3b540bc-faa6-4dc7-8637-7098735f14b0,Suddenly wall recent who strategy impact knowledge character.,225750,13501,1796
47,Instagram,2025-03-20,https://instagram.com/post/2f9bcc5c-f9f8-432f-a7a7-d6637a1a7cb8,Itself one establish edge address data daughter civil American.,158763,36647,2882
47,Instagram,2025-05-09,https://instagram.com/post/a194bff0-5b61-4e5d-b034-abe69d5bda6e,Bit pressure try street suddenly success whom knowledge material move.,240391,41206,3704
47,Instagram,2025-04-18,https://instagram.com/post/55a0f5df-2305-435f-825b-5a1fa711f9ff,Exactly mother relate black believe front eight.,196558,34236,4971
48,Instagram,2025-03-15,https://instagram.com/post/b33c8a73-3163-4132-bc9c-9d46eecfec89,Nice series other most relationship production make nearly data apply else.,467388,107817,15081
48,Instagram,2025-03-09,https://instagram.com/post/198d848a-dcc7-481a-878c-5b539779643d,Interest one lead another matter.,259861,35903,4614
48,Instagram,2025-07-07,https://instagram.com/post/dcad92ae-2ee1-4487-93e4-d518f418af83,Conference need fact entire lay unit.,535051,36397,2917
49,Twitter,2025-03-26,https://twitter.com/post/66b0773f-9bbb-420e-bd1e-113c5ad45756,Want policy popular consumer force security garden than wife.,24758,1892,230
49,Twitter,2025-02-13,https://twitter.com/post/685c29a2-9042-4bfe-81bb-311f96ff89e8,Exactly arrive age sense meet.,98681,15411,2855
49,Twitter,2025-05-10,https://twitter.com/post/b7e506ba-b922-4df1-a6a8-b60e0f9b0bd7,Condition attorney will threat wind phone.,85582,8677,1476
49,Twitter,2025-01-19,https://twitter.com/post/d3efd173-03e9-4096-9053-cacca9c527f9,Society police room size set among those environment.,53200,11241,1763
49,Twitter,2025-06-23,https://twitter.com/post/7449c9a2-6aec-4be6-a213-ab945d17ad5e,Wish bill beautiful particular enter last audience.,39905,2914,564
50,Instagram,2025-06-06,https://instagram.com/post/2f102e8a-6799-4bf1-9a4b-01d25ca88a2d,Section speech old hundred than toward.,74991,7133,1034
50,Instagram,2025-04-17,https://instagram.com/post/d55f4593-0584-4c09-b46c-25c3bd457ef0,Seek care feel there section.,67915,8793,1528
50,Instagram,2025-03-16,https://instagram.com/post/eb505e87-7eec-41d5-a8a9-69df54cc8856,Heart your five form rest lay describe beyond.,57524,3915,380
51,YouTube,2025-05-03,https://youtube.com/post/7364f764-02e5-44f2-b752-7b365c8f1261,Community exist recently young stay wonder painting author weight.,179159,25253,3646
51,YouTube,2025-04-19,https://youtube.com/post/bf817f9e-af18-41af-83a7-893d5b0d1402,Reduce like why effect arm doctor year owner level break.,217924,36374,6176
51,YouTube,2025-02-13,https://youtube.com/post/7e6c9431-823f-41f5-9cc2-a78f695b7731,Surface letter send former represent across.,294430,21101,1471
51,YouTube,2025-03-11,https://youtube.com/post/1de10a9b-2dd8-4cba-b09b-50eae6f0bb31,Yard what case direction look.,33101,7508,941
52,Instagram,2025-04-19,https://instagram.com/post/ed76e3ff-e129-4d8d-a29a-79cc7b3aef4d,Poor population each before international.,467487,82782,9017
52,Instagram,2025-03-10,https://instagram.com/post/796c0a78-94ef-45d0-ac7a-31f276935386,Pretty bar story especially people important guess.,501303,90158,4493
52,Instagram,2025-05-07,https://instagram.com/post/66ab287f-4b07-4d51-9d6c-0edddb576f4e,Thousand wear traditional sure around then capital.,86245,4954,987
53,YouTube,2025-04-03,https://youtube.com/post/0ade374a-a987-478b-8f9e-902cad6e3bad,Fly walk room stock concern I however watch appear.,54790,12462,661
53,YouTube,2025-03-14,https://youtube.com/post/4893554e-8856-40f1-89ee-1c6f29f79db0,College evening collection pull relationship summer score.,158617,29200,4564
54,Twitter,2025-05-10,https://twitter.com/post/c83b625a-6232-41cf-942b-211d6e599242,Close cold include material feel argue.,83290,16268,2936
54,Twitter,2025-07-05,https://twitter.com/post/1ed1e005-3ea8-44e7-ba49-2a6d074751dd,Any our moment beat.,91590,19851,2673
54,Twitter,2025-06-10,https://twitter.com/post/54f88839-e051-47f2-b277-96ac3ab4baf0,Hit herself machine third poor computer one we activity too.,126482,13400,1974
54,Twitter,2025-05-10,https://twitter.com/post/8f76ff96-4f21-42ee-8b50-8b6802839c8d,Morning your note house actually court toward Mr many.,37845,5258,368
54,Twitter,2025-06-27,https://twitter.com/post/b170f0f3-233a-4e50-8ce4-03586a6e9c4e,Congress half they thing since doctor full.,55702,13713,1267
55,YouTube,2025-02-24,https://youtube.com/post/c2c16c6d-5ada-4608-a1f2-eb5276167a27,Kid scientist carry government thing vote source.,73484,7728,1503
55,YouTube,2025-03-19,https://youtube.com/post/4e586aa3-22dc-4ab0-8140-9636b4747690,Foreign thought after eye of.,504546,108395,4941
55,YouTube,2025-01-25,https://youtube.com/post/d0d24868-0d1f-4126-bda4-380a7ed0f329,Break case return whose Democrat include.,147016,26153,5102
55,YouTube,2025-02-05,https://youtube.com/post/c2e0b442-a847-4a28-9204-b5c4c817605d,Paper often toward store prove very make.,68646,8011,1586
56,Twitter,2025-07-18,https://twitter.com/post/561d0eb7-f861-477e-a073-f9320df70cdd,Financial himself order relationship exactly bit relate decade.,75834,15396,1004
56,Twitter,2025-07-04,https://twitter.com/post/b17d65ec-aef8-4cea-a0ea-c249300fc746,Risk manage wear current southern security moment.,145880,32668,2804
56,Twitter,2025-05-13,https://twitter.com/post/2177abc4-f277-4628-8052-3c235c2573c3,Resource human tell commercial get water.,113364,26085,795
57,Instagram,2025-04-08,https://instagram.com/post/3341c200-3c2a-4384-9abb-747e04e80779,Relationship drug approach responsibility keep finally a.,250181,39539,6553
57,Instagram,2025-06-27,https://instagram.com/post/c7c9e604-8040-4d6a-80c0-5e4dbb5576d7,Bring water scene ever.,46590,10403,545
57,Instagram,2025-03-06,https://instagram.com/post/402cad56-7821-48bd-b8a7-a965ef04969c,Hear black dark would television into plant fear.,104196,21640,2815
58,Instagram,2025-03-25,https://instagram.com/post/6521ac10-ac6d-49b3-be99-041d8131a2f4,Night world small some especially.,131944,7979,1245
58,Instagram,2025-05-24,https://instagram.com/post/3d7c2c42-891d-4ebd-be5f-5ba91c8a74e3,Cup maintain material benefit wait serious daughter.,307023,61138,6783
59,Instagram,2025-02-18,https://instagram.com/post/57d66c04-ff38-43eb-8e6c-b77bc25261f1,Threat page even perform so song song try people provide.,616024,44237,5116
59,Instagram,2025-06-06,https://instagram.com/post/f637d3c8-3261-401d-b576-8c418cb4cfd3,Very follow once five final red note age specific.,1056699,61999,10115
59,Instagram,2025-06-14,https://instagram.com/post/d2a22d1e-529e-4b00-856e-602232a80f98,Beautiful conference matter common west watch.,976722,150698,16255
59,Instagram,2025-01-31,https://instagram.com/post/a949adc6-6139-429d-ab3e-d1abca197877,Continue check statement only as middle evidence.,1075675,66869,7451
60,Twitter,2025-02-06,https://twitter.com/post/f37e7c32-019f-4c9f-81fa-14281c0041bc,Stock behind result money would popular among mean improve.,35866,2567,387
60,Twitter,2025-01-30,https://twitter.com/post/8fa0d8e6-7b2f-4848-8ed6-c4602e7ee40e,Artist successful best drive father poor.,37065,8519,722
60,Twitter,2025-02-18,https://twitter.com/post/73c7fca1-9ab6-4c75-be26-05e8f9c56957,Six player never character big.,16591,1248,169
60,Twitter,2025-04-12,https://twitter.com/post/822972e3-e3dd-40b3-b421-a02887ef0a4a,His responsibility culture seem leg recently reveal major society boy.,46899,9024,855
60,Twitter,2025-05-11,https://twitter.com/post/a781b9a0-3774-455d-933b-97a6469a6904,Feeling could team hour modern able.,47733,5201,603
61,Instagram,2025-04-25,https://instagram.com/post/55c27764-5748-4a03-86f3-fb60285bf0bf,Glass year son follow body hope quite area month make.,205200,39061,6834
61,Instagram,2025-05-13,https://instagram.com/post/e701c89d-28c6-4612-bf11-f95ca01d04eb,Start management reduce east thus onto effect west.,800802,163197,24894
61,Instagram,2025-01-26,https://instagram.com/post/944e6d2f-0784-4577-83ea-13552485f82e,Cause feeling paper main long less much.,330254,46338,3190
61,Instagram,2025-05-02,https://instagram.com/post/7bca1198-dd11-4325-8254-cacf45266ea1,Look less music visit organization design alone little character.,464014,65286,6575
61,Instagram,2025-07-17,https://instagram.com/post/a580f057-0f82-4d1a-94d9-1694c038b452,Piece hit author authority reveal.,200782,27176,3888
62,Instagram,2025-03-03,https://instagram.com/post/027c5e4b-0709-4068-abcf-18e2464efaf0,Trade gun ahead describe break.,591411,110809,12258
62,Instagram,2025-07-11,https://instagram.com/post/380fdbb6-4d61-458b-b3f6-64a6fe5923b6,With left turn subject member method person to book author.,103126,6916,715
62,Instagram,2025-05-20,https://instagram.com/post/258e601b-8889-4fd6-a226-120b5a73d38e,Quickly any research third contain big.,473070,58911,3070
62,Instagram,2025-06-05,https://instagram.com/post/497e2451-6b7f-44b1-a49d-ac191e817d6f,Media of instead cold car same.,85436,20617,2587
63,Instagram,2025-01-24,https://instagram.com/post/d3451bea-7146-4485-9b39-6fb569fca1e8,Direction stay yeah serious.,224829,50523,9598
63,Instagram,2025-05-06,https://instagram.com/post/f62defb8-4124-450b-809d-1716665b4fc1,Right speech out himself present individual glass trouble but everybody.,230264,53690,2080
64,YouTube,2025-03-25,https://youtube.com/post/88ac3395-658d-48ce-a5fa-b0c902ff9e64,Feel discover article perform reflect interesting media.,235059,28284,3627
64,YouTube,2025-02-02,https://youtube.com/post/0651e148-1075-4bc6-9881-71809f1fec41,Project trade ten couple red happy candidate step some point.,103244,18723,1275
64,YouTube,2025-02-05,https://youtube.com/post/9e3bbbe0-6594-48cb-818a-5005ba65e41b,Eat young kitchen study cold individual.,67706,14832,1371
64,YouTube,2025-07-01,https://youtube.com/post/37c2a5cd-8bcb-4557-ad11-383030dd02f4,Point which yes wish employee allow baby note question shake.,290208,47832,7998
65,YouTube,2025-04-29,https://youtube.com/post/8cf7b88f-ce36-41ea-bdde-7ee2bc6c39b9,Collection enough official whom reach.,587664,106699,15779
65,YouTube,2025-02-15,https://youtube.com/post/4e5e308c-05da-447e-b53d-426a02965ffc,Tough kid front fire college election eight positive.,100640,10532,1681
66,Instagram,2025-02-12,https://instagram.com/post/de8bce83-afdc-4b03-952d-663e34ba91d8,Feeling even end raise recognize.,115831,9994,543
66,Instagram,2025-07-05,https://instagram.com/post/cf8936c2-8a8d-41dd-821e-4b89fcfbdae0,Officer color task level cultural north commercial blue hot.,196119,12535,1955
66,Instagram,2025-04-04,https://instagram.com/post/52b49e2e-f820-4785-9fbf-a157ce8081b7,Claim attack nation condition election someone local head.,278541,19038,2288
66,Instagram,2025-01-19,https://instagram.com/post/a8300fef-7274-488f-9d46-a915bcb9a905,Matter including apply continue accept especially bill.,122428,17229,977
67,YouTube,2025-06-20,https://youtube.com/post/021bbfd6-f6cc-438c-9a42-6e43d6e7c5c5,Piece growth clearly behavior pull southern whatever against.,709918,145793,18441
67,YouTube,2025-05-27,https://youtube.com/post/0c017e2d-99db-47a8-beb2-ba703e675950,A military room technology contain trade.,153661,9299,527
67,YouTube,2025-06-06,https://youtube.com/post/8243ec89-4002-4bb5-9c27-f214eb7ae9c7,Hear seven upon range adult.,619260,114435,8726
67,YouTube,2025-06-09,https://youtube.com/post/680a0e3d-7948-4b0f-b1c3-aa75babe09f8,Shoulder education skin make rock everyone other above minute.,657793,96782,10176
68,Twitter,2025-06-02,https://twitter.com/post/96bd1f16-3a7c-40b6-8942-a9abdf62d6b9,Drop seem memory big course crime foot general analysis front begin.,171916,26211,2324
68,Twitter,2025-02-15,https://twitter.com/post/32ff829d-5d7b-4c44-80fe-ed22d94d2868,Quality low common it report.,113197,21014,2749
68,Twitter,2025-07-15,https://twitter.com/post/b896b368-f84d-4807-a484-45911bce8004,Discover art sound medical office treatment true.,346574,38706,2612
68,Twitter,2025-06-19,https://twitter.com/post/8c14c197-496c-4b5f-ad1a-64ec303676d6,Quite television resource recognize stop president consumer bring general.,603212,36769,2380
69,Instagram,2025-03-02,https://instagram.com/post/92cceb1a-c1cf-4dcf-9b2c-435b9b5ff3c0,True week western about crime way although feeling read wish.,512162,103882,8228
69,Instagram,2025-05-27,https://instagram.com/post/c198ca7e-2cb9-44ed-ba52-0653fd9ce661,Color green require letter team.,125849,18811,1941
69,Instagram,2025-03-19,https://instagram.com/post/5cd435f5-2c80-463f-8da5-e813b7bd8b51,Seven office food nature shoulder measure others lose.,131340,20556,1420
70,Twitter,2025-07-16,https://twitter.com/post/47a3907f-5717-4f77-af5e-4dfd898641b8,Organization share around mention various until car different.,14568,3239,120
70,Twitter,2025-06-13,https://twitter.com/post/839485b1-f1aa-47e7-8a15-34c8a64f1222,Always here data season action well control bit sell.,9801,2295,405
70,Twitter,2025-05-07,https://twitter.com/post/78d01a72-7032-4779-9d43-8a17a43e78bd,Road present item candidate record pattern.,59592,9813,1477
70,Twitter,2025-03-16,https://twitter.com/post/40c9fe47-beb7-4fe9-9b1c-42bb47f431c1,Energy if according fish politics security.,45463,3320,111
71,Twitter,2025-07-20,https://twitter.com/post/51d9ffd5-ec1d-4b3a-88ef-cd3f782c6f4b,Note walk daughter man American change.,288290,69052,7472
71,Twitter,2025-02-20,https://twitter.com/post/725c709a-9fbc-4956-8227-fd57956150ad,Much beautiful treatment for suffer talk remain coach whatever.,856282,104783,10922
71,Twitter,2025-04-20,https://twitter.com/post/d5145f6f-ae0b-442b-8671-647720b87e4c,Increase defense offer anything few use line ground clearly war.,215872,29603,2903
71,Twitter,2025-02-27,https://twitter.com/post/817f8fd8-103e-47aa-afb9-7c57711996f0,Model more better cover thousand top phone network west.,186014,41686,6535
72,Twitter,2025-04-19,https://twitter.com/post/99b12e6f-ea92-43e1-9e70-5607dff5265c,Smile according run get themselves across kind sea individual similar.,24098,2015,235
72,Twitter,2025-02-16,https://twitter.com/post/624f0901-02eb-41b9-bd3f-c267cf8f04ac,Others authority court day pass authority quickly one.,11648,1770,325
72,Twitter,2025-02-05,https://twitter.com/post/470da9dc-8046-403c-8d06-297f0869393b,Hope hotel wall I guess important business him have.,25025,4891,827
73,Twitter,2025-04-30,https://twitter.com/post/d96717d9-1324-463b-b8c0-298c8fce41ed,Good their religious base lay wall also election.,223863,17749,1127
73,Twitter,2025-03-19,https://twitter.com/post/8094ac96-27a6-4703-83b3-391599adbc01,Create image Mrs remain guess adult house.,474379,95844,13555
73,Twitter,2025-01-22,https://twitter.com/post/8f644794-b8e6-4cc8-be5c-e8c4f737dfd7,Politics such man hospital apply build.,183410,37520,4277
74,Twitter,2025-05-27,https://twitter.com/post/19f28584-7561-4165-a627-4c565ec61a72,Nearly probably test hard how discuss cover hotel.,190385,43104,6004
74,Twitter,2025-05-30,https://twitter.com/post/5b380e07-e520-4ecb-a7f8-4a1a0c361068,Benefit course discussion than try stand training.,265695,30459,5941
74,Twitter,2025-04-23,https://twitter.com/post/6b8ec83d-0d37-4fad-9d07-dcb24031d204,Floor various consider American nearly word.,100377,13847,1519
74,Twitter,2025-02-26,https://twitter.com/post/cba56bd4-991f-4918-a866-d7cb8063ad3f,Left conference people range second former.,178117,37273,4865
74,Twitter,2025-06-06,https://twitter.com/post/28010e74-2ac1-4c1e-a5f6-554042910be0,Force allow husband sometimes design property probably.,109206,7080,768
75,Instagram,2025-03-08,https://instagram.com/post/ad19c29c-ae26-4c5d-95df-cd132eb042f6,Water stage wish suffer seem most doctor major perhaps picture.,69097,14948,643
75,Instagram,2025-02-04,https://instagram.com/post/2feaf7b0-24cd-4b03-8f69-18d90578328f,Its everything hit study grow fish although.,446548,98713,13281
76,Instagram,2025-05-09,https://instagram.com/post/aa2695fa-3996-4b3d-8b80-491893cad5ce,At anyone price small campaign air reveal several within then.,207988,33457,5507
76,Instagram,2025-05-01,https://instagram.com/post/2194ae10-66b3-4f23-9aef-325304b9a208,Enjoy various series message opportunity woman student agree table sure moment.,370724,51881,8698
76,Instagram,2025-04-10,https://instagram.com/post/c8d1f163-7dd3-47fe-adea-09c6ea7f7842,High others parent structure high entire.,279041,31895,3535
76,Instagram,2025-03-02,https://instagram.com/post/951306c5-914e-4446-974e-ab0212f2438e,Although word citizen one factor resource treatment blue civil floor.,90830,5665,269
76,Instagram,2025-03-04,https://instagram.com/post/6f68b4c4-4650-47e3-b126-32ca7c39526c,Market yourself just hair than choose surface.,371945,44145,6685
77,Instagram,2025-06-01,https://instagram.com/post/0231013b-7cca-4d4e-bb56-77318cd59664,Garden another lot option TV throughout meeting there also little.,85882,16448,3264
77,Instagram,2025-06-15,https://instagram.com/post/65172222-c48a-4369-85d8-4374a288bed3,Economy true specific manage young describe.,406115,69835,6415
77,Instagram,2025-01-24,https://instagram.com/post/8b60313f-51dc-4abe-ad19-e34a2a74d755,Could garden actually western next professor civil along across consider.,666216,84931,13729
78,YouTube,2025-04-27,https://youtube.com/post/4a01f1d4-40a5-4517-bcc2-9ad1ed1b5dc4,East against everyone eye develop suffer have difficult man.,523244,93901,3869
78,YouTube,2025-04-25,https://youtube.com/post/e87b4a22-f0ea-445b-9d61-c20ae3228554,Rule court trade sister can painting feeling relate shoulder people money.,110229,20466,1602
79,Instagram,2025-03-28,https://instagram.com/post/2a4a2a39-0419-49da-9dfe-bd7534ca23fc,Cold own represent affect bar together friend check push produce.,434953,72440,3914
79,Instagram,2025-07-20,https://instagram.com/post/f18e3282-1657-45a1-b4da-c5cfd518f042,Find with right why land commercial how first stop wait.,451827,110037,16367
79,Instagram,2025-05-28,https://instagram.com/post/599cd12a-c913-4b1c-b88e-5c882a426d07,Late one explain shake beat effect different administration sport.,495025,83663,15850
80,Twitter,2025-04-23,https://twitter.com/post/7123e177-1324-47a3-81a7-0effa318f7e7,Protect bring shoulder picture environment traditional east however.,335583,59968,5147
80,Twitter,2025-05-22,https://twitter.com/post/10895919-4462-4617-9e65-a92ee2ee7f98,Reduce fact far wish bar.,112941,21522,4110
80,Twitter,2025-02-11,https://twitter.com/post/1a8605aa-ef24-4117-a321-a6cce671289f,Pick report standard material significant seat thousand.,561898,130635,5994
80,Twitter,2025-02-08,https://twitter.com/post/1bd93af8-0a4f-4506-bed5-de4451c63d20,Make why center push find know wrong between million rate.,393181,59644,1974
81,Instagram,2025-04-07,https://instagram.com/post/54e4b845-5765-433d-8e60-720737a88118,Near indicate sport market whether chair.,168424,15636,2988
81,Instagram,2025-02-12,https://instagram.com/post/1dec4849-2ca6-46ba-9c93-36cf2df92701,Bit couple kind two night walk.,358485,34166,1823
81,Instagram,2025-06-21,https://instagram.com/post/c06d23f3-00ab-40cd-9c57-d0484de7398b,Responsibility key cup condition.,104390,22849,1078
81,Instagram,2025-05-29,https://instagram.com/post/e917f264-a70d-463b-90aa-1bf9e0035b1d,Policy foot argue back writer thank feeling worker young crime.,535251,116162,20935
82,Twitter,2025-06-18,https://twitter.com/post/e0381c0e-fef9-4404-bde0-c88859c09e5d,General trial act education and before thus.,817370,184135,24870
82,Twitter,2025-02-16,https://twitter.com/post/b1faa748-8696-4050-b4eb-02ab189b38b7,Short million leg land only blue move agreement democratic natural.,747143,60406,3669
83,Instagram,2025-03-31,https://instagram.com/post/52b22d2b-e868-4936-b56d-31f6c4c5f366,Early chair foot mind thing space member step cause.,117053,6875,632
83,Instagram,2025-05-05,https://instagram.com/post/49a77993-e90a-4988-aa97-9b25dfb061b8,Live this science dream great yard.,116823,28495,3812
83,Instagram,2025-01-22,https://instagram.com/post/ae57c719-b647-4537-ade3-58583767019d,Research discussion different successful whom green book itself.,121552,25132,1753
84,Twitter,2025-04-20,https://twitter.com/post/541e12b9-e623-43a0-8439-4eb397c6e286,Form most before exactly free her top person.,134521,28481,3125
84,Twitter,2025-07-16,https://twitter.com/post/042c4168-0a1b-4c98-b785-66dc17ccc4a3,Not politics himself officer modern.,311130,38445,7343
84,Twitter,2025-01-25,https://twitter.com/post/0342bc74-8902-4a72-a660-372d2a84bec6,Type side certain guess bag already beat.,361302,51426,4006
85,Twitter,2025-02-12,https://twitter.com/post/8f77cee8-172d-41b3-a70d-b937bea6d71f,College hear future night guess improve high.,477416,63845,3674
85,Twitter,2025-03-03,https://twitter.com/post/57bd8acb-7b2c-498a-8d8b-cd0eeb656397,Face agree artist memory put ever between.,233642,39937,7125
85,Twitter,2025-07-10,https://twitter.com/post/aef43ef5-8295-49d8-b849-de8c60e3bbac,Shake mean writer after involve police investment less owner theory.,115040,16809,1565
85,Twitter,2025-02-20,https://twitter.com/post/e0f3e32a-a048-4b4e-a73a-e5676166eddf,Hotel moment situation better radio manage suffer.,824243,158485,18654
85,Twitter,2025-04-09,https://twitter.com/post/9b24e0e2-1d6f-47e5-90b5-8c2df57745ae,Sometimes leg option top better Mr yeah.,173327,11573,662
86,Instagram,2025-02-11,https://instagram.com/post/55f22e53-ce07-46da-96fd-abd705324a53,Feeling of news watch themselves finish left yes game.,299513,23802,2484
86,Instagram,2025-05-16,https://instagram.com/post/a6167cb5-aece-4d8e-b5b7-4f176a0f0f23,Hot while reality represent serious person run race.,311871,29442,3141
86,Instagram,2025-05-16,https://instagram.com/post/80f77e2f-f3d8-4fb7-9493-fdbbca082f0c,Yeah state third among matter song inside change must.,132434,7328,286
86,Instagram,2025-06-06,https://instagram.com/post/33d12077-3d29-4823-a250-d65d6dcba132,Control gas hope condition reduce down none detail national.,178260,17318,3447
86,Instagram,2025-03-14,https://instagram.com/post/bbe8f74f-ebba-40c6-8d3f-be32632e678e,Professional station point film.,140049,7791,1466
87,Instagram,2025-03-17,https://instagram.com/post/e4977653-298e-4bf0-bf45-a557ae92a7f6,Side society young assume environmental better.,54570,4230,333
87,Instagram,2025-06-24,https://instagram.com/post/e396cd37-c7cc-4f83-a9b9-7d5d3dc1e96e,Since difference address bar.,56944,10774,577
87,Instagram,2025-02-04,https://instagram.com/post/e976cc57-1553-45ce-88be-efaebba93824,Cup option century friend difficult course.,49260,6882,212
87,Instagram,2025-03-02,https://instagram.com/post/6a2ac2c3-2a1d-4695-aa08-4111b2537570,Station professional happy scene many watch.,10522,1064,182
88,Instagram,2025-04-04,https://instagram.com/post/bf1d7468-fb22-4e1a-a01b-3d7e6f8e0a6e,Ready officer nature tough market help.,63285,6810,552
88,Instagram,2025-03-21,https://instagram.com/post/16c417d8-330e-467c-9c10-64232673c563,Model generation natural even whom because as believe store.,43420,5816,959
88,Instagram,2025-02-13,https://instagram.com/post/a2e994f5-6281-4cba-a12e-a1c7b187110e,Company attack economic professional resource tree west accept six.,171612,12385,2277
88,Instagram,2025-05-28,https://instagram.com/post/3836c477-53a7-4adc-a360-470a03080191,Attack modern history situation board bag large bill mission coach.,215335,11474,1349
88,Instagram,2025-04-10,https://instagram.com/post/1117c3d1-d5a4-4140-87f7-e8a6d0a78eb3,A project American close democratic old international option laugh would.,104230,8204,844
89,Twitter,2025-04-21,https://twitter.com/post/4369b404-da65-4757-bb47-790250108276,Explain best open be send maintain more per.,167164,22285,3185
89,Twitter,2025-03-22,https://twitter.com/post/b4b53265-2504-464f-8d86-52cdf348966e,But certain offer main any year claim newspaper man.,89022,21804,904
89,Twitter,2025-05-03,https://twitter.com/post/70afe30c-d507-41f3-bd11-e13121961d00,What data hair care quickly with recently truth couple.,311142,47127,9331
89,Twitter,2025-06-23,https://twitter.com/post/ba917ee3-bfdb-4202-b06e-367ff913ffb9,Worker leader hospital only travel necessary.,325309,41669,4580
90,Twitter,2025-01-23,https://twitter.com/post/c8a59a1b-5f87-457b-9f85-c53f8f4ec21a,Customer vote into close paper get form.,1103682,111173,3642
90,Twitter,2025-02-10,https://twitter.com/post/d0979c7a-80f1-43d8-bfdb-1ccfec921fd2,Scientist their girl senior floor important than.,905464,107714,16652
90,Twitter,2025-02-09,https://twitter.com/post/caec532e-d868-4ae5-8bb0-ab9e9b5a6f2f,Many analysis unit wide treatment might democratic accept.,740456,151275,23444
90,Twitter,2025-03-16,https://twitter.com/post/c7071089-7503-470a-87d5-d27ee87949a9,Them baby past student build.,435963,25663,3151
90,Twitter,2025-07-08,https://twitter.com/post/d0f5b1db-7c73-463e-b038-71768ad21c80,Particular dream much nearly mouth.,931192,79167,12861
91,YouTube,2025-02-03,https://youtube.com/post/880ef816-11fb-4516-8533-fa0da89350c3,Establish game start woman number firm table of beautiful.,1043487,152042,9272
